scores,avg_score,types,date,room,useful,comments
"位置:5.0,设施:5.0,服务:5.0,卫生:5.0",5,独自旅行,2017年07月入住,豪华单人房,0,酒店卫生干净，设施完善，位置很好，周边很繁华，服务态度很好，符合我对四星酒店的预期，很满意的一次住宿。
"位置:5.0,设施:4.0,服务:5.0,卫生:5.0",4.8,朋友出游,2017年10月入住,标准双床间,0,没有去过大连，看到酒店距离地铁站比较近，评价不错就定了，但是酒店的早餐确实不敢恭维，很一般，总体来说还行吧
"位置:4.0,设施:4.0,服务:5.0,卫生:4.0",4.3,商务出差,2017年09月入住,豪华单人房,0,中规中矩的四星级酒店，预定的房型已满，酒店给了免费升级。酒店前台每人都有英文名字，尤其是位男生，记得好像最后一个英文字母是x，为人友善，热情。
"位置:5.0,设施:5.0,服务:5.0,卫生:5.0",5,商务出差,2017年12月入住,标准双床间,0,酒店位置便利，近地铁，房间干净，环境好，服务热心周到，周围饮食便利，可选店铺众多，我选的房间不能加床。
"位置:5.0,设施:5.0,服务:5.0,卫生:5.0",5,家庭亲子,2018年08月入住,标准大床间,0,酒店不错，房间就能看见码头大海
"位置:5.0,设施:5.0,服务:5.0,卫生:5.0",5,商务出差,2017年09月入住,标准双床间,,来了好几次了，上次来的时候是7月份，真是都挺好，就上次来的时候没地方停车，车场的人态度特别差，我也没惯病大声吵闹，叫来了酒店经理，经理是个美女，和车场的人协调帮我找车位，结果车场的人态度特别差根本不听，哇！美女也没惯病特有范有气场！问车场的人叫什么？为何与客人说话一点儿不客气？找了车场领导三下五除二帮我解决了停车问题，这我才知道酒店车场不归酒店管，包出去了，但这位美女经理给我的印象特别深刻！看起来有点儿冷，和我说话又温柔又热情！和车场的人沟通又厉害又有范！那叫一个有型！不过这两次去都没看见，听说是不干了！太可惜了！酒店内个小个子的大堂经理也不错。
"位置:5.0,设施:4.0,服务:5.0,卫生:4.0",4.5,朋友出游,2019年05月入住,标准大床间,0,性价比可以
"位置:4.0,设施:4.0,服务:4.0,卫生:4.0",4,商务出差,2017年12月入住,,0,出差旅行。酒店离海边不近。周围吃饭地方不多。离大超市有步行10多钟路程。酒店服务还可以，总体还行吧！
"位置:5.0,设施:4.0,服务:4.0,卫生:5.0",4.5,商务出差,2018年10月入住,标准双床间,0,酒店毗邻三八广场、二七广场、港湾广场，地理位置好，交通便利，酒店停车也很方便。周围吃饭非常方便，酒店硬件设施不错，床品非常舒适！
"位置:5.0,设施:4.0,服务:5.0,卫生:5.0",4.8,商务出差,2018年10月入住,豪华单人房,0,早餐好呀，房间也是OK，服务方面四星应该还是有了，\n\n就可惜\n酒店装潢有年头了，不如精品酒店的现代\n其他都还好，说得过去
"位置:5.0,设施:5.0,服务:5.0,卫生:5.0",5,商务出差,2018年05月入住,标准大床间,0,房间干净、也很安静，景色不错，性价比高，推荐！
"位置:5.0,设施:5.0,服务:5.0,卫生:5.0",5,商务出差,2017年06月入住,,,老酒店，当地住客很多，说明品质不错，\n早餐一般
"位置:5.0,设施:5.0,服务:5.0,卫生:5.0",5,家庭亲子,2018年08月入住,标准双床间,0,叫外卖很方便，附近也不少吃的
"位置:5.0,设施:5.0,服务:5.0,卫生:5.0",5,商务出差,2018年08月入住,标准双床间,0,老牌4星，直接感觉干净，床品舒服。
"位置:4.0,设施:4.0,服务:4.0,卫生:4.0",4,家庭亲子,2017年10月入住,标准双床间,0,酒店服务还不错，前台的工作人员都挺热情，房间的部分硬件虽有些陈旧，但不影响使用，房间装修的还不错，总体还是比较满意的
"位置:4.0,设施:4.0,服务:3.0,卫生:5.0",4,家庭亲子,2018年08月入住,,0,一开始订的豪华标间两间，想让酒店安排在同一楼层，结果酒店告知，豪华标间、商务房每一层只各有一间，无奈只能修改成豪华标间、商务房各一间，但入住当天酒店没有安排好，还是没住在同一楼层，后来嫌麻烦就没调房间。酒店后来客服来电话询问服务评价由于我正在超市结账让客服过一分钟再来电话，结果一直等了两天直到退房都没再打给我。酒店的拖鞋只给第一天的，后面的就不给了，两个老人好面子不好意思和服务员要。商务房两床之间有个床头柜，可以自行拼床，但离店时需要客人自行恢复原状。酒店位置不错去哪都方便，门口也有几家不错的菜馆。
"位置:5.0,设施:5.0,服务:5.0,卫生:5.0",5,朋友出游,2017年08月入住,标准大床间,0,每次去大连，都选良运。可能比较专一。位置还好吧，因为开车去，停在酒店，都是打车出门。入住速度很快，前台服务热情。退房也很迅速。房间干净无异味，客房阿姨送了空气净化器。下次去大连依旧选择良运！
"位置:5.0,设施:4.0,服务:5.0,卫生:5.0",4.8,情侣出游,2017年08月入住,标准双床间,0,酒店位置较好，距离地铁二号线很近，房间小一点，但比较温馨，卫生间很好，整体配置有点简单，早餐还行，但有点拥挤，有停车场，但管理人员不是酒店的，态度一般般，不能及时给客人找车位，酒店经理应很好协调一下关系。作为四星酒店还是很超值的！
"位置:4.0,设施:4.0,服务:4.0,卫生:4.0",4,家庭亲子,2018年07月入住,亲子房,0,比较老的酒店啦。都还行。卫浴是科勒的
"位置:5.0,设施:5.0,服务:5.0,卫生:5.0",5,家庭亲子,2018年07月入住,标准双床间,0,不错的酒店，性价比高，位置停车方便。
"位置:5.0,设施:4.0,服务:4.0,卫生:4.0",4.3,商务出差,2017年06月入住,豪华单人房,0,酒店里办事情的地方很近，酒店的总体环境还好，就是房间的窗户不方便开启，不知道以后能不能有所改进，希望下次入住有不同。
"位置:5.0,设施:3.0,服务:5.0,卫生:5.0",4.5,商务出差,2019年05月入住,标准大床间,0,酒店老了，好多设备需维修，早餐需加强，服务很好
"位置:5.0,设施:4.0,服务:5.0,卫生:5.0",4.8,商务出差,2018年11月入住,标准双床间,0,还行，就是房间有点小
"位置:5.0,设施:5.0,服务:5.0,卫生:5.0",5,商务出差,2019年04月入住,标准大床间,0,总体还不错
"位置:5.0,设施:4.0,服务:5.0,卫生:5.0",4.8,独自旅行,2018年10月入住,标准双床间,0,很不错的酒店 性价比很高
"位置:5.0,设施:5.0,服务:5.0,卫生:5.0",5,商务出差,2018年02月入住,标准大床间,0,房间非常干净，每次来大连必须住这里，很专一，地点也好，大床非常舒服！
"位置:5.0,设施:5.0,服务:5.0,卫生:5.0",5,朋友出游,2018年12月入住,豪华单人房,0,停车场有，位置不错
"位置:5.0,设施:5.0,服务:5.0,卫生:5.0",5,家庭亲子,2018年07月入住,标准双床间,0,不愧是四星级，位置和服务都很棒。
"位置:2.0,设施:2.0,服务:2.0,卫生:2.0",2,商务出差,2018年09月入住,标准双床间,0,房间很小，不值那个钱，不推荐
"位置:5.0,设施:4.0,服务:4.0,卫生:5.0",4.5,代人预订,2018年08月入住,标准大床间,0,酒店位置不错，外观稍微老旧了点，早餐还是很丰盛的。替领导预订，算价廉物美吧，夏天旅游旺季，有点小贵了。前台接待希望能更有亲和力点。
"位置:5.0,设施:5.0,服务:5.0,卫生:5.0",5,家庭亲子,2018年09月入住,标准双床间,0,连住了三天，整体感觉还是很舒适的，床也好睡\n美中不足就是被芯容易掉出来一些，不知道是被芯被套大小不合适还是因为没有绑绳子
"位置:5.0,设施:5.0,服务:5.0,卫生:5.0",5,商务出差,2018年06月入住,标准大床间,0,比较满意的入住，环境优美，交通便利。。。。。。。。。。。。。。。。。。。。。。。。。。。。。。。。。。
"位置:5.0,设施:5.0,服务:5.0,卫生:5.0",5,商务出差,2018年11月入住,标准大床间,0,老牌子酒店，适合会议
"位置:4.0,设施:5.0,服务:5.0,卫生:4.0",4.5,商务出差,2019年04月入住,标准双床间,0,早餐挺好的
"位置:5.0,设施:5.0,服务:5.0,卫生:5.0",5,家庭亲子,2018年10月入住,标准双床间,0,标准双人间不能加床，我跟宝宝睡在挨着墙边的床，床边需要塞两个枕头，这样防止孩子掉下去，早点带着宝宝去吃，还不错。
"位置:5.0,设施:3.0,服务:5.0,卫生:4.0",4.3,情侣出游,2018年08月入住,标准双床间,0,酒店设施有点老久，服务热情
"位置:5.0,设施:5.0,服务:5.0,卫生:5.0",5,商务出差,2019年01月入住,标准大床间,0,很好的一次体验
"位置:5.0,设施:5.0,服务:5.0,卫生:5.0",5,家庭亲子,2017年08月入住,,0,挺好的，靠近大连港，坐船比较方便～房间设施较老，但是比较干净。打车到星海广场25元。出租车很多，交通便利。门前有酒店停车场，这是自驾游出行比较方便的。
"位置:4.0,设施:4.0,服务:5.0,卫生:5.0",4.5,商务出差,2018年09月入住,,0,非常不错的酒店，值得推荐
"位置:4.0,设施:5.0,服务:5.0,卫生:5.0",4.8,其它,2017年08月入住,,0,硬件不错！比较满意，下次到大连还可以考虑入驻！
"位置:5.0,设施:4.0,服务:5.0,卫生:5.0",4.8,商务出差,2017年09月入住,标准大床间,0,是一家相当好的酒店。服务热情周到，房间卫生舒适，还能看到海港。周边环境不错，晚上很安静。周边美食不少，步行几分钟既到。
"位置:5.0,设施:5.0,服务:5.0,卫生:5.0",5,家庭亲子,2017年08月入住,,0,酒店不错，大厅比较豪华，电梯快。房间设施略显陈旧，不过不影响任何使用，设施配备比较到位，房间挺大，可能订的商务房的缘故~四星酒店里面算不错了，入住体验不错~
"位置:5.0,设施:4.0,服务:4.0,卫生:5.0",4.5,家庭亲子,2017年08月入住,标准双床间,,从携程上看了网评订了房间，房间虽小，但是卫生很好，设施也很全，整洁干净，服务单位。而且周边交通吃饭都很便捷，到东港海边走着一刻钟，酒店负责停车的师傅很热情，介绍了玩的和吃的地方，特别热心，总之不错，下次去还住良运。
"位置:5.0,设施:5.0,服务:5.0,卫生:5.0",5,家庭亲子,2017年08月入住,标准双床间,0,酒店干净，还有空气净化器，位置佳，可以看到海，交通方便。已经第二次入住了，因为第一次住的印象好，所以这次自己游玩时也在此入住，依然舒心。
"位置:5.0,设施:5.0,服务:5.0,卫生:5.0",5,家庭亲子,2017年08月入住,标准双床间,0,非常满意，酒店干净，可透过楼宇之间看见海，周边吃饭，购物以及游玩都比较方便，离老虎滩，棒槌岛，俄罗斯风景街，东港都只有6.、7公里，自驾出行很方便，酒店服务也不错👍，值得入住。
"位置:5.0,设施:3.0,服务:3.0,卫生:5.0",4,家庭亲子,2017年08月入住,,0,前台💁服务态度良好，豪华标准间的空间也算舒适，内部装修风格比较中规中矩，商务气息浓厚，两张1.2米的床，带一个孩子在一张小床上太局促了 ，卫生间的淋浴效果太棒了！洗去一身疲惫。寝具被褥有些潮，房间的空调制冷效果太好了，晚上居然被冻醒。周围用餐也比较方便。
"位置:5.0,设施:5.0,服务:5.0,卫生:5.0",5,家庭亲子,2017年08月入住,标准双床间,,地理位置不错，离地铁二号线港湾广场站只有两分钟路程，比住火车站附近环境好太多了；酒店工作人员服务不错，可以提供免费的衣物烘干服务；没带泳衣所以没能体验酒店的泳池；特别感谢工程处的一位老师傅，很用心的帮助我们解锁坏了的行李箱！街对面一家兰州拉面和飞碟鱼鸽海鲜美食都特别棒！
"位置:5.0,设施:4.0,服务:5.0,卫生:4.0",4.5,家庭亲子,2018年08月入住,亲子房,0,酒店的地理位置非常棒，吃饭、购物、交通都便利。没有在酒店内餐厅吃饭，外面有永和豆浆、重庆小面，胡同里饭店，价廉物美。酒店的停车场对住店客人免费，我们租车游，很方便。有孩子住亲子房，1张单人床，1张大床。
"位置:5.0,设施:4.0,服务:5.0,卫生:4.0",4.5,家庭亲子,2018年08月入住,标准双床间,0,酒店的地理位置非常棒，吃饭、购物、交通都便利。没有在酒店内餐厅吃饭，外面有永和豆浆、重庆小面，胡同里饭店，价廉物美。酒店的停车场对住店客人免费，我们租车游，很方便。有孩子住亲子房，1张单人床，1张大床。
"位置:5.0,设施:5.0,服务:5.0,卫生:5.0",5,朋友出游,2018年10月入住,标准大床间,0,地理位置好，酒店也不错。
"位置:5.0,设施:5.0,服务:5.0,卫生:5.0",5,情侣出游,2017年10月入住,标准双床间,0,酒店位置很好 有的高楼层可以看到一点海景 停车还算方便 没有停不下车的时候 有人指挥 记得找前台要停车票
"位置:5.0,设施:5.0,服务:5.0,卫生:5.0",5,商务出差,2018年07月入住,标准大床间,0,体验还是很好的，服务和房间都很好
"位置:4.0,设施:4.0,服务:4.0,卫生:4.0",4,商务出差,2018年07月入住,标准双床间,0,没有浴缸，有单独的淋浴间，床很舒服
"位置:5.0,设施:5.0,服务:4.0,卫生:5.0",4.8,家庭亲子,2018年08月入住,标准大床间,0,酒店虽然老些，4星酒店在这可以啦
"位置:5.0,设施:5.0,服务:5.0,卫生:5.0",5,朋友出游,2017年08月入住,标准双床间,0,地理位置很好，去到什么地方都比较方便，综合来说，酒店在这个区域的性价比是比较高的。下次去还会选择住在这里的，非常值得推荐给大家。
"位置:5.0,设施:5.0,服务:5.0,卫生:5.0",5,商务出差,2018年12月入住,标准双床间,0,还可以，位置也不错
"位置:5.0,设施:5.0,服务:5.0,卫生:5.0",5,商务出差,2018年11月入住,标准双床间,0,服务不错，设施旧了
"位置:5.0,设施:5.0,服务:5.0,卫生:5.0",5,商务出差,2019年01月入住,标准双床间,0,很好，就是价格贵
"位置:5.0,设施:5.0,服务:5.0,卫生:5.0",5,其它,2017年08月入住,,0,到大连旅游住在这里，酒店很棒，标准的四星级，订的豪华双床房，帮我们升级为了商务房，房间大，非常干净，浴室宽敞，还有一个大浴缸，非常满意
"位置:5.0,设施:5.0,服务:5.0,卫生:5.0",5,家庭亲子,2017年07月入住,标准双床间,,酒店地处繁华地带，住店的话停车场是免费的，早餐种类还算多，服务挺热情。
"位置:5.0,设施:5.0,服务:5.0,卫生:5.0",5,家庭亲子,2018年08月入住,亲子房,0,暑期大连的酒店价格偏高，追求性价比的话，良运绝对首选。带孩子带老人，都住得很舒适。只是这里经常满房，要提前预定，不然临时续订的话，就不太容易了。26层顶层有个健身房，对酒店客人免费，上去参观了一下，没什们人，但是从哪里看下风景也不错。早餐45一位，小一点的孩子不要钱，大孩子1米4以下是半价。性价比很高，而且早餐时段人不多，基本到了就有位子，连续吃三天，都是如此。
"位置:5.0,设施:5.0,服务:5.0,卫生:5.0",5,家庭亲子,2018年08月入住,,0,早餐性价比很高，即使定的不含早房间，单独付费45一位，个人认为也很值。住的亲子房，一张1.5米双人床，和一张1.2米单人床，即使二该家庭都能住下。酒店门口有个小型停车场，怎么收费不太清楚。出门向左，见到红绿灯再向左，就是“歹街”，步行五分钟就到。
"位置:5.0,设施:5.0,服务:5.0,卫生:5.0",5,家庭亲子,2018年08月入住,,0,定的商务间，前台看有老人有小孩，主动给升级了套间。真的要为前台接待点赞，主动为客人考虑。虽然不是无烟楼层，但房间里也没什么烟味。挺好。早餐性价比很高，45元一位，原本没报太大期望，但去了才发现，超值。
"位置:5.0,设施:5.0,服务:5.0,卫生:5.0",5,家庭亲子,2018年08月入住,,0,挂牌四星，服务绝对过硬。带着老人和孩子，选择良运，真是正确。前台服务很好。门口的餐厅胡同里，价格不贵，但卫生状况一般。个人更推荐前行几十米的大清花，性价比更高。
"位置:5.0,设施:5.0,服务:5.0,卫生:5.0",5,家庭亲子,2017年08月入住,标准双床间,0,第一次认真点评酒店，主要是因为真心觉得很好。这次是带孩子假日游玩，一共去了四个城市，住了四家酒店，第一家住的就是良运。从这家酒店走后没有一家觉得比得上这家的。第一，地理位置。是坐飞机到的大连，一出机场就有免费的大巴，虽然有点绕路，但毕竟免费不是吗。大巴送到了路口，步行了大概5分钟就到酒店了。走时坐的轮渡，到大连港步行也就不到10分钟。还是比较方便的。第二，服务。第一个接触的是酒店的迎宾，有些年龄的一位男士。他带我们去看了房间，很热心的介绍了周围的餐饮和交通。而且在以后的几天中每次见到我们都会打招呼。这让我们觉得很温暖，毕竟宾至如归最真实的感觉也就这样了不是吗？前台的接待也很好，虽然人多但是不显忙乱，能够达到快速有效的接待住客，态度和效率兼顾了。第三，房间设施。因为是老牌酒店，设施难免有些陈旧，不过是东西总有旧的时候。只要不影响使用，不有碍观瞻就可以了。唯一美中不足的地方也在这里，就是房间有点小。对于只是晚上住宿来说够了，不过带着孩子还是觉得有点小。第四，单独说下内配用品吧。布草不算很新，但应该是酒店自洗的。应该属于高温消毒，至少我没闻到刺鼻的消毒水味道或者消洗灵的味道。在这里特意说一下，酒店有自己的洗衣房，这是正经的老牌星级酒店才会有的，比那些送到所谓的洗涤公司，用着不符合人体接触要求的消毒剂来达到消毒目的的酒店要好得多。而且因为来自北方不喜欢大连的潮湿，酒店提供了免费的烘干衣物的服务，带着一个皮孩子，这点简直太棒了，宝宝每天都可以穿干净的干燥的衣服。总得来说，我愿意向我认识的每一个来大连的人推荐这家酒店。
"位置:5.0,设施:4.0,服务:5.0,卫生:5.0",4.8,家庭亲子,2018年06月入住,标准大床间,0,环境卫生设施都挺好，就是大床房床不大
"位置:5.0,设施:5.0,服务:5.0,卫生:5.0",5,朋友出游,2018年06月入住,标准双床间,0,酒店位置很好，旅游购物吃饭都很方便！
"位置:4.0,设施:5.0,服务:4.0,卫生:4.0",4.3,家庭亲子,2017年10月入住,,0,酒店性价比高，中规中矩，免费升了一间房到商务间，早餐种类还可以，品质也凑合，对得起45元一位这个价格。
"位置:5.0,设施:5.0,服务:5.0,卫生:5.0",5,情侣出游,2017年10月入住,,0,酒店非常不错的，比图片好太多了，性价比非常高，距离威尼斯水城比较近，酒店服务也不错，唯一美中不足的就是早餐不太好吃
"位置:4.0,设施:5.0,服务:4.0,卫生:5.0",4.5,情侣出游,2017年10月入住,标准大床间,0,有停车场 酒店房间干净整洁 设施齐全 装修也不错 离中山广场步行约十分钟 周边吃的也很多 还是不错的
"位置:5.0,设施:5.0,服务:5.0,卫生:5.0",5,家庭亲子,2018年10月入住,标准双床间,0,酒店位置好，周边公交几乎直达所有大连必去景点，周围饭馆小吃很多，还有海鲜批发市场，酒店前台服务很好。
"位置:4.0,设施:4.0,服务:4.0,卫生:4.0",4,商务出差,2018年11月入住,标准双床间,0,两周之间住了两次，价格一样，第一次房间比第二次房间大一些，早餐较好，位置很好，出行交通方便，周围饭馆较多
"位置:5.0,设施:4.0,服务:5.0,卫生:5.0",4.8,情侣出游,2017年04月入住,标准双床间,,1、看点评选的这家酒店，果然干净服务态度好；\n2、房间不大，室内摆设合理精致；\n3、羽绒被，床铺柔软舒适，躺在上面满足感油然而生；\n4、距离火车站5站地；\n5、挂牌四星，大堂宽敞漂亮，若干免费休息区，优雅舒适。
"位置:5.0,设施:5.0,服务:5.0,卫生:5.0",5,家庭亲子,2018年08月入住,,0,早餐很不错，地理位置也很方便！
"位置:4.0,设施:3.0,服务:4.0,卫生:4.0",3.8,商务出差,2018年11月入住,,0,无线上网信号不好
"位置:5.0,设施:5.0,服务:5.0,卫生:5.0",5,商务出差,2018年12月入住,标准大床间,0,前台服务非常棒。
"位置:3.0,设施:3.0,服务:3.0,卫生:3.0",3,商务出差,2018年06月入住,标准大床间,0,离办事的地方比较近，酒店很一般
"位置:5.0,设施:5.0,服务:5.0,卫生:5.0",5,家庭亲子,2018年08月入住,,0,位置好，硬件好，服务好，早餐好，推荐！
"位置:5.0,设施:5.0,服务:5.0,卫生:5.0",5,家庭亲子,2017年07月入住,标准双床间,0,房间还可以，不带早餐，早餐一个人45，小孩子1.1米以上都要钱这个不合理，现在孩子都长得高，我家孩子五岁不到，已经1.2米了，可是吃饭还没有猫多，建议更改一下标准
"位置:5.0,设施:5.0,服务:5.0,卫生:5.0",5,朋友出游,2017年08月入住,标准双床间,0,很干净 前台礼貌 房服礼貌 酒店环境不像是我印象里的老四星酒店 很干净很舒服 位置很好去哪里都方便 以后再来大连还会选择住在这里 
"位置:5.0,设施:5.0,服务:5.0,卫生:5.0",5,家庭亲子,2017年08月入住,标准双床间,0,酒店一进去就感觉很好。是那种传统式4星酒店，设施稍微陈旧一点。卫生啊环境啊都很好！特别喜欢的是酒店提供免费衣服烘干，很人性化！
"位置:5.0,设施:2.0,服务:2.0,卫生:3.0",3,商务出差,2018年09月入住,标准双床间,0,较差，房间卫生脏设施老
"位置:5.0,设施:5.0,服务:4.0,卫生:5.0",4.8,情侣出游,2018年04月入住,标准大床间,0,卫生环境都可以，就是入住check的时间比较久
"位置:5.0,设施:5.0,服务:5.0,卫生:5.0",5,商务出差,2019年01月入住,标准大床间,0,房间非常舒适
"位置:5.0,设施:5.0,服务:5.0,卫生:5.0",5,商务出差,2018年11月入住,标准大床间,0,酒店地理位置方便出行，早餐不错服务很好👍，房间稍显老旧但是卫生可以很干净
"位置:5.0,设施:5.0,服务:5.0,卫生:5.0",5,家庭亲子,2018年06月入住,标准大床间,0,真心不错，房间卫生干净，续住一晚
"位置:5.0,设施:5.0,服务:5.0,卫生:5.0",5,家庭亲子,2018年08月入住,亲子房,0,免费升级了房型！真的很好！
"位置:5.0,设施:5.0,服务:5.0,卫生:5.0",5,商务出差,2018年10月入住,标准大床间,0,不错，整体感觉非常好
"位置:5.0,设施:5.0,服务:5.0,卫生:5.0",5,独自旅行,2018年09月入住,标准大床间,0,酒店在闹市区，交通方便
"位置:5.0,设施:5.0,服务:5.0,卫生:5.0",5,商务出差,2019年01月入住,标准大床间,0,全部都挺好的
"位置:5.0,设施:5.0,服务:5.0,卫生:5.0",5,商务出差,2018年07月入住,标准大床间,0,环境舒适，服务周到，房间整洁
"位置:5.0,设施:5.0,服务:5.0,卫生:5.0",5,独自旅行,2018年07月入住,,0,房间设施完善 环境非常不错
"位置:4.0,设施:4.0,服务:4.0,卫生:4.0",4,商务出差,2018年12月入住,标准大床间,0,早餐一般。客户住
"位置:5.0,设施:5.0,服务:5.0,卫生:5.0",5,朋友出游,2018年06月入住,单人套房,0,位置优，单人套房空间大，性价比高
"位置:5.0,设施:5.0,服务:5.0,卫生:5.0",5,家庭亲子,2018年06月入住,标准双床间,0,酒店出行方便，卫生很好，周围吃饭方便，很好好好好好好好好好好好好好好好好好好好好好好好好好好好好好好！
"位置:4.0,设施:4.0,服务:4.0,卫生:4.0",4,家庭亲子,2018年08月入住,标准双床间,0,还行吧，离东港音乐广场近
"位置:5.0,设施:5.0,服务:5.0,卫生:5.0",5,商务出差,2018年08月入住,标准大床间,0,酒店服务，环境，前台服务很满意
"位置:5.0,设施:5.0,服务:5.0,卫生:5.0",5,其它,2019年03月入住,,0,酒店非常好
"位置:5.0,设施:5.0,服务:5.0,卫生:5.0",5,独自旅行,2018年09月入住,标准双床间,0,位置还可以，早餐挺丰富。
"位置:4.0,设施:4.0,服务:4.0,卫生:4.0",4,商务出差,2018年09月入住,,0,比较安静，交通也还方便。
"位置:5.0,设施:5.0,服务:5.0,卫生:5.0",5,商务出差,2019年01月入住,,0,早餐不错 出脚方便
"位置:5.0,设施:5.0,服务:5.0,卫生:5.0",5,其它,2019年01月入住,标准大床间,0,可以，非常感谢
"位置:5.0,设施:5.0,服务:5.0,卫生:5.0",5,家庭亲子,2018年07月入住,标准双床间,0,几年前来过，再次入住还不错。
"位置:5.0,设施:5.0,服务:5.0,卫生:5.0",5,家庭亲子,2018年07月入住,标准双床间,0,卫生比较好服务太度也不错
"位置:5.0,设施:5.0,服务:5.0,卫生:5.0",5,朋友出游,2019年05月入住,标准双床间,0,位置很好，CBD
"位置:5.0,设施:5.0,服务:5.0,卫生:5.0",5,商务出差,2018年06月入住,标准双床间,0,酒店位置挺好的，住的房间能看见海。
"位置:1.0,设施:1.0,服务:3.0,卫生:2.0",1.8,家庭亲子,2018年08月入住,标准双床间,0,和四星级酒店严重不匹配
